{
  "schema_version": "v2",
  "enrollment_id": "dddddddd-dddd-4ddd-8ddd-dddddddddddd",
  "readiness_state": "eligible",
  "next_ordinal": 1,
  "remaining_entitlement": 1,
  "entitlement_source": "baseline",
  "baseline_attempt_limit": 1,
  "active_attempt_id": null,
  "active_session_id": null,
  "start_command_digest": "aaaaaaaaaaaaaaaaaaaaaaaaaaaaaaaaaaaaaaaaaaaaaaaaaaaaaaaaaaaaaaaa",
  "bound_version_candidates": [],
  "history": [],
  "required_notices": [],
  "permitted_actions": ["start_attempt", "return_to_my_work"]
}
